{
  "schemaId": "DeFlow.contextpacket.v1",
  "runId": "run_20260807T101500Z_ac1012",
  "nodeId": "framing",
  "attempt": 1,
  "builtAtEvent": 5,
  "target": {
    "provider": "claude",
    "model": "claude-sonnet-4-6",
    "maxContext": 200000
  },
  "budget": {
    "fraction": 0.5,
    "limitTokens": 100000
  },
  "totals": {
    "tokens": 297,
    "byKind": {
      "pinned.constraints": 181,
      "pinned.spec": 0,
      "pinned.pathscope": 0,
      "task.brief": 116,
      "fact": 0,
      "artifact.handle": 0,
      "retrieved": 0,
      "history.summary": 0,
      "tool.output": 0
    }
  },
  "renderedPromptHandle": "artifact://069e10148c732d25fabc95b7e879a957ccf5df6c837f5a73c721187df126e7fe",
  "pinnedDigests": [
    "sha256-7feaf65eb17825978cf47ec5ddb616584939997dc46f9d94d02320754a76ef23",
    "sha256-515efbf9a113fc47cea477cc79204f9583276708adc00291451820136bb28ac0"
  ],
  "segments": [
    {
      "id": "pinned-constraints-safety",
      "kind": "pinned.constraints",
      "sourceEvent": 5,
      "contentHash": "sha256-7feaf65eb17825978cf47ec5ddb616584939997dc46f9d94d02320754a76ef23",
      "tokens": {
        "estimated": 14,
        "method": "heuristic"
      },
      "pinned": true,
      "compactable": false,
      "text": "Safety constraints (pinned):\n- never commit a credential"
    },
    {
      "id": "pinned-constraints-permission",
      "kind": "pinned.constraints",
      "sourceEvent": 5,
      "contentHash": "sha256-515efbf9a113fc47cea477cc79204f9583276708adc00291451820136bb28ac0",
      "tokens": {
        "estimated": 167,
        "method": "heuristic"
      },
      "pinned": true,
      "compactable": false,
      "text": "Permission level (pinned): read\nYou may read this repository and you may ask the operator a clarifying question. You may not write a file and you may not run a command that changes one.\nConnected tools (issue trackers, code hosts, and any other server this machine is connected to) are governed by DeFlow policy: non-destructive reads are pre-authorized, and a denied tool call is a policy or environment fact, never an operator decision — no one was asked, so never describe a denial as the operator declining. Consult connected trackers directly while you frame: looking something up is part of this interrogation, not a step to put in a plan or behind an approval."
    },
    {
      "id": "task-raw",
      "kind": "task.brief",
      "sourceEvent": 1,
      "contentHash": "sha256-4e113a9c3be808025a98449c19a8966741d50d631b56e0c2ae56318b55b8bc4f",
      "tokens": {
        "estimated": 26,
        "method": "heuristic"
      },
      "pinned": false,
      "compactable": true,
      "text": "The submitted task, verbatim:\nMigrate the design system to Vue 3. Keep the public component API stable."
    },
    {
      "id": "task-rejected-spec",
      "kind": "task.brief",
      "sourceEvent": 4,
      "contentHash": "sha256-6cf51bf76dd40c068087cb7c8727a2c311f6302dcf3fd3fb6bdd17bdc2fac998",
      "tokens": {
        "estimated": 90,
        "method": "heuristic"
      },
      "pinned": false,
      "compactable": true,
      "text": "A previous framing attempt produced the spec below and the operator rejected it.\nRejection reason: The criteria say nothing about the date picker, which is the risky component.\n\nRejected goal:\nMigrate every component under packages/ui to Vue 3.\n\nRejected non-goals:\n- Do not touch packages/legacy.\n\nRejected acceptance criteria:\n- ac-1: pnpm typecheck passes."
    }
  ]
}